<filters xmlns="filters" xmlns:xsi="http://www.w3.org/2001/XMLSchema-instance"
    xsi:schemaLocation="filters validation/filters.xsd">
    <TestFilter enabled="false">
        <direction>include</direction>
        <parameter>testClass</parameter>
        <values>
            <value>class1</value>
            <value>class2</value>
        </values>
    </TestFilter>
    <TestFilter enabled="false">
        <direction>exclude</direction>
        <parameter>testClass</parameter>
        <values>
            <value>eqjdia</value>
        </values>
    </TestFilter>
    <TestFilter enabled="false">
        <direction>exclude</direction>
        <parameter>testMethod</parameter>
        <values>
            <value>testi</value>
        </values>
    </TestFilter>
    <PriorityFilter enabled="true">
        <direction>ascending</direction>
        <parameter>testClass</parameter>
        <values>
            <value>class1</value>
        </values>
    </PriorityFilter>
</filters>