<filters
    xmlns="filters"
    xmlns:xsi="http://www.w3.org/2001/XMLSchema-instance"
    xsi:schemaLocation="filters validation/filters.xsd">
 <TestFilter enabled="true">
  <direction>exclude</direction>
  <parameter>testMethod</parameter>
  <values>
   <value>testMetdshodfsdf3231</value>
  </values>
 </TestFilter>
 <TestFilter enabled="true">
  <direction>include</direction>
  <parameter>testClass</parameter>
  <values>
   <value>TestExample8</value>
  </values>
 </TestFilter>
 <PriorityFilter enabled="true">
  <direction>descending</direction>
  <parameter>testMethod</parameter>
  <values>
  </values>
 </PriorityFilter>
</filters>
