<filters
    xmlns="filters"
    xmlns:xsi="http://www.w3.org/2001/XMLSchema-instance"
    xsi:schemaLocation="filters validation/filters.xsd">
 <TestFilter enabled="false">
  <direction>include</direction>
  <parameter>testId</parameter>
  <values>
   <value>2</value>
  </values>
 </TestFilter>
 <TestFilter enabled="false">
  <direction>include</direction>
  <parameter>testClass</parameter>
  <values>
   <value>TestMediaRouter</value>
  </values>
 </TestFilter>
</filters>
